{
  "screen": "screen.landing.home",
  "figmaNodeId": "5164:6346",
  "version": "2026-07-02",
  "figmaLastModified": "2026-07-01T07:26:09Z",
  "root": {
    "type": "stack",
    "direction": "vertical",
    "children": [
      {
        "slug": "component.navbar.root"
      },
      {
        "slug": "component.navbar.mobile.root"
      },
      {
        "slug": "component.navbar.motion.root"
      },
      {
        "slug": "component.landing.hero.root"
      },
      {
        "slug": "component.landing.hero.mobile.root"
      },
      {
        "slug": "component.landing.hero.motion.root"
      },
      {
        "slug": "component.landing.problem.root"
      },
      {
        "slug": "component.landing.problem.mobile.root"
      },
      {
        "slug": "component.landing.problem.motion.root"
      },
      {
        "slug": "component.landing.comparisonFirst.root"
      },
      {
        "slug": "component.landing.comparisonFirst.mobile.root"
      },
      {
        "slug": "component.landing.comparisonFirst.motion.root"
      },
      {
        "slug": "component.landing.howItWorksTeaser.root"
      },
      {
        "slug": "component.landing.howItWorksTeaser.mobile.sectionRoot"
      },
      {
        "slug": "component.landing.howItWorksTeaser.motion.root"
      },
      {
        "slug": "component.navbar.motion.cta"
      },
      {
        "slug": "component.navbar.mobile.leadingCluster"
      },
      {
        "slug": "component.navbar.mobile.cta"
      },
      {
        "slug": "component.navbar.cta"
      },
      {
        "slug": "component.navbar.brand"
      },
      {
        "slug": "component.navbar.navLinks"
      }
    ]
  }
}
